{
  "schema_version":"1.0.0",
  "label":"NEXT_LABEL",
  "framework":"निष्पक्ष समझ के शमीकरण यथार्थ सिद्धांत उपलब्धि यथार्थ युग",
  "state":"HEART_VIEW_FRAMEWORK",
  "epistemic_status":"FRAMEWORK_DESCRIPTION",
  "principles":[
    "निष्पक्ष समझ",
    "शमीकरण",
    "यथार्थ सिद्धांत",
    "उपलब्धि यथार्थ युग",
    "हृदय का शिरोमणि स्वरुप दृष्टिकोण",
    "संपूर्ण संतुष्टि की निरंतरता",
    "खुद के स्थाई स्वरुप से रुबरु",
    "खुद के स्थाई परिचय से परिचित"
  ],
  "integrity":{
    "physiological_inactivity_claimed":false,
    "empirical_certainty_invented":false
  }
}